{
	"technique": {
		"type": "path",
		"max_depth": 64
	},
	"camera": {
		"type": "perspective",
		"fov": 40,
		"near_clip": 0.1,
		"far_clip": 100,
		"transform": [ 1,0,0,0, 0,1,0,0, 0,0,1,-4, 0,0,0,1 ]
	},
	"film": {
		"size": [1000, 1000]
	},
	"bsdfs": [
		{"type":"diffuse", "name": "mat-Lobe", "reflectance": 0.8}
	],
	"shapes": [
		{"type":"gauss_lobe", "name":"Lobe", "direction":[0,1,1], "x_axis": [-1,0,0], "y_axis": [0,0,1], "sigma_theta": 0.35, "sigma_phi": 0.4, "anisotropy": 0.0, "scale": 1},
		{"type":"sphere", "name":"Origin", "radius": 0.1}
	],
	"entities": [
		{"name":"Lobe","shape":"Lobe","bsdf":"mat-Lobe"},
		{"name":"Origin","shape":"Origin","bsdf":"mat-Lobe"}
	],
	"lights": [
		{"type":"constant", "name":"Environment", "radiance":1}
	]
}
