{
	"technique": {
		"type": "path",
		"max_depth": 64
	},
	"camera": {
		"type": "perspective",
		"fov": 40,
		"near_clip": 0.1,
		"far_clip": 100,
		"transform": [ 1,0,0,0, 0,1,0,0, 0,0,1,-4, 0,0,0,1 ]
	},
	"film": {
		"size": [1000, 1000]
	},
	"bsdfs": [
		{"type":"diffuse", "name": "mat-Lobe", "reflectance": 0.8}
	],
	"shapes": [
		{"type":"gauss", "name":"Lobe", "normal":[0,1,0], "sigma": 0.35, "radius_scale": 1, "height": 1}
	],
	"entities": [
		{"name":"Lobe","shape":"Lobe", "bsdf":"mat-Lobe"}
	],
	"lights": [
		{"type":"constant", "name":"Environment", "radiance":1}
	]
}
