{
	"technique": {
		"type": "path",
		"max_depth": 2,
		"aov_normals": true,
		"aov_mis": true,
		"aov_stats": true
	},
	"camera": {
		"type": "perspective",
		"fov": 60,
		"near_clip": 0.01,
		"far_clip": 100,
		"transform": [ 1,0,0,0, 0,0,1,-8, 0,1,0,0 ]
	},
	"film": {
		"size": [1000, 1000]
	},
	"externals": [
		{"filename": "primitive_scene_data.json"}
	]
}
