{
	"technique": {
		"type": "path",
		"max_depth": 2
	},
	"camera": {
		"type": "perspective",
		"fov": 60,
		"near_clip": 0.01,
		"far_clip": 100,
		"transform": [ 1,0,0,0, 0,0,1,-8, 0,1,0,0 ]
	},
	"film": {
		"size": [1000, 1000]
	},
	"bsdfs": [
		{"type":"diffuse", "name": "ground", "reflectance":[0.8, 0.8, 0.8]},
		{"type":"diffuse", "name": "object", "reflectance":[0.95, 0.95, 0.95]}
	],
	"shapes": [
		{"type":"rectangle", "name":"Bottom", "width":10, "height":8},
		{"type":"icosphere", "name":"IcoSphere"}
	],
	"entities": [
		{"name":"Bottom","shape":"Bottom", "bsdf":"ground", "transform": [{"translate":[0,0,-1]}]},
		{"name":"IcoSphere","shape":"IcoSphere", "bsdf":"object"}
	],
	"lights": [
		{"type":"area", "name":"Light", "entity": "IcoSphere", "radiance":[1,1,1]}
	]
}
