{
  "technique": {
    "type": "path",
    "max_depth": 4,
    "clamp": 0.0
  },
  "camera": {
    "type": "perspective",
    "fov": 39.597752709049864,
    "near_clip": 0.10000000149011612,
    "far_clip": 100.0,
    "transform": [
      -1.0,
      0.0,
      0.0,
      0.0,
      0.0,
      1.0,
      0.0,
      0.0,
      0.0,
      0.0,
      -1.0,
      5.0,
      0.0,
      0.0,
      0.0,
      1.0
    ]
  },
  "film": {
    "size": [
      256.0,
      256.0
    ]
  },
  "shapes": [
    {
      "type": "ply",
      "name": "Plane.001",
      "filename": "meshes/Plane.001.ply"
    }
  ],
  "bsdfs": [
    {
      "type": "transparent",
      "name": "Plane__1",
      "color": "color(1.0, 0.08654338866472244, 0.1086520180106163, 1.0)"
    },
    {
      "type": "transparent",
      "name": "Plane__2",
      "color": "color(0.15525473654270172, 0.38431301712989807, 1.0, 1.0)"
    },
    {
      "type": "blend",
      "name": "Plane",
      "first": "Plane__1",
      "second": "Plane__2",
      "weight": 0.5
    }
  ],
  "entities": [
    {
      "name": "Plane.001-Plane.001",
      "shape": "Plane.001",
      "bsdf": "Plane",
      "transform": [
        0.7071068286895752,
        0.7071067690849304,
        0.0,
        0.0,
        -0.7071067690849304,
        0.7071068286895752,
        0.0,
        0.0,
        0.0,
        0.0,
        1.0,
        0.699999988079071,
        0.0,
        0.0,
        0.0,
        1.0
      ]
    }
  ],
  "lights": [
    {
      "type": "env",
      "name": "__scene_world",
      "radiance": "color(0.20000000298023224, 0.20000000298023224, 0.20000000298023224, 1.0)",
      "transform": [
        0,
        1,
        0,
        0,
        0,
        1,
        1,
        0,
        0
      ]
    }
  ]
}