{
	"technique": {
		"type": "path",
		"max_depth": 64
	},
	"camera": {
		"type": "fishlens",
		"mode": "full",
		"near_clip": 0.1,
		"far_clip": 100,
		"transform": [{"lookat": {"direction":[0,1,0]}}]
	},
	"film": {
		"size": [1000, 1000]
	},
	"textures": [
		{
			"type": "image",
			"name": "env",
			"filename": "textures/environment/phalzer_forest_01_4k.exr"
		}
	],
	"lights": [
		{"type":"env", "name":"Environment", "radiance":"env"}
	]
}
