{
	"technique": {
		"type": "path",
		"max_depth": 4
	},
	"camera": {
		"type": "perspective",
		"fov": 40,
		"near_clip": 0.1,
		"far_clip": 100,
		"transform": [ -1,0,0,0, 0,1,0,0, 0,0,-1,15, 0,0,0,1 ]
	},
	"film": {
		"size": [1000, 1000]
	},
	"textures": [
		{
			"type": "bitmap",
			"name": "env",
			"filename": "textures/environment/phalzer_forest_01_4k.exr"
		},
		{
			"type": "checkerboard",
			"name": "check",
			"scale_x": 10,
			"scale_y": 10,
			"color0": [0,0,0],
			"color1": [1,1,1]
		},
		{
			"type": "bitmap",
			"name": "mask",
			"filename": "textures/mask.png"
		}
	],
	"bsdfs": [
		{"type":"diffuse", "name": "mat-Fallback"},
		{"type":"conductor", "name": "mat-BackInner", "specular_reflectance": [0.7, 0.4, 0.04]},
		{"type":"bumpmap", "name": "mat-Back", "bsdf":"mat-BackInner", "map":"perlin(20*uv)*voronoi(15*uv)*0.02"},
		{"type":"diffuse", "name": "mat-Floor", "reflectance":"check(uv*2*sin(uv.x*4*Pi) + P.xy*avg(uv) - vec2(Eps, E)) * select(uv.x > noise(sum(uv)), color(1,0.5,0), color(0,0.5,1))"},
		{"type":"diffuse", "name": "mat-PlaneSurface", "reflectance":[0, 0.552, 0.721]},
		{"type":"mask", "name": "mat-Plane", "bsdf": "mat-PlaneSurface", "weight":"mask.r"}
	],
	"shapes": [
		{"type":"rectangle", "name":"Floor", "width": 10, "height": 10},
		{"type":"rectangle", "name":"Back", "width": 10, "height": 5},
		{"type":"box", "name":"Plane", "width": 4, "height": 4, "depth": 0.1}
	],
	"entities": [
		{"name":"Floor","shape":"Floor", "bsdf":"mat-Floor"},
		{"name":"Back","shape":"Back", "bsdf":"mat-Back", "transform": [{"rotate": [90,0,0]}, {"translate": [0,2.5,-5]}]},
		{"name":"Plane","shape":"Plane", "bsdf":"mat-Plane", "transform": [{"rotate": [0,0,45]}, {"translate": [0,0,2]}]}
	],
	"lights": [
		{"type":"env", "name":"Sky", "radiance": "env", "transform": [1,0,0, 0,0,1, 0,1,0]}
	]
}
