{
	"technique": {
		"type": "path",
		"max_depth": 6
	},
	"camera": {
		"type": "fisheye",
		"near_clip": 0.1,
		"far_clip": 100
	},
	"film": {
		"size": [1000, 1000]
	},
	"bsdfs": [
		{"type":"diffuse", "name": "Material", "reflectance":[0.8,0.8,0.8]}
	],
	"shapes": [
		{"type":"cube", "name":"Cube"}
	],
	"entities": [
		{"name":"Bottom","shape":"Cube", "bsdf":"Material"}
	],
	"lights": [
		{"type":"env", "name":"Env", "radiance":[100,100,100]}
	]
}
