{
	"technique": {
		"type": "path",
		"max_depth": 64
	},
	"camera": {
		"type": "perspective",
		"fov": 39.597755,
		"near_clip": 0.1,
		"far_clip": 100,
		"transform": [ -1,0,0,0, 0,1,0,0, 0,0,-1,3.849529, 0,0,0,1 ]
	},
	"film": {
		"size": [1000, 1000]
	},
	"textures": [
		{
			"type": "bitmap",
			"name": "tex",
			"filename": "textures/bumpmap.png",
			"filter_type": "trilinear"
		},
		{
			"type": "checkerboard",
			"name": "check",
			"scale_x": 10,
			"scale_y": 5,
			"color0": [0.3,0.3,0.3],
			"color1": [1,1,1]
		}
	],
	"bsdfs": [
		{"type":"diffuse", "name": "mat-Sphere", "reflectance":"check"}
	],
	"shapes": [
		{"type":"uvsphere", "name":"Sphere"}
	],
	"entities": [
		{"name":"Sphere","shape":"Sphere", "bsdf":"mat-Sphere"}
	],
	"lights": [
		{"type":"sky", "name":"Sky"},
		{"type":"sun", "name":"Sun", "sun_direction":[0.4082482904638631,0.4082482904638631,0.8164965809277261]}
	]
}
