{
	"technique": {
		"type": "path",
		"max_depth": 64
	},
	"camera": {
		"type": "perspective",
		"fov": 40,
		"near_clip": 0.1,
		"far_clip": 100,
		"transform": [ 1,0,0,0, 0,1,0,0, 0,0,1,-4, 0,0,0,1 ]
	},
	"film": {
		"size": [1000, 1000]
	},
	"bsdfs": [
		{"type":"diffuse", "name": "mat-Sphere", "reflectance": 0.8}
	],
	"shapes": [
		{"type":"ply", "name":"Sphere", "filename":"meshes/Sphere.ply", "flip_normals": true}
	],
	"entities": [
		{"name":"Sphere","shape":"Sphere", "bsdf":"mat-Sphere", "transform": [-1,0,0, 0,-1,0, 0,0,-1]}
	],
	"lights": [
		{"type":"constant", "name":"Environment", "radiance":1}
	]
}
