{
	"technique": {
		"type": "path",
		"max_depth": 4
	},
	"camera": {
		"type": "perspective",
		"fov": 40,
		"near_clip": 0.1,
		"far_clip": 100,
		"transform": [ -1,0,0,0, 0,1,0,0, 0,0,-1,15, 0,0,0,1 ]
	},
	"film": {
		"size": [1000, 1000]
	},
	"textures": [
		{
			"type": "bitmap",
			"name": "env",
			"filename": "textures/environment/phalzer_forest_01_4k.exr"
		},
		{
			"type": "checkerboard",
			"name": "check",
			"scale_x": 10,
			"scale_y": 10,
			"color0": [0,0,0],
			"color1": [1,1,1]
		},
		{
			"type": "bitmap",
			"name": "mask",
			"filename": "textures/mask.png"
		}
	],
	"bsdfs": [
		{"type":"diffuse", "name": "mat-Fallback"},
		{"type":"diffuse", "name": "mat-Floor", "reflectance":"check"},
		{"type":"diffuse", "name": "mat-Plane", "reflectance":"color(0.1, 0.4, 1)*check(uv+vec2(t*0.2, t*0.1))"}
	],
	"shapes": [
		{"type":"rectangle", "name":"Floor", "width": 10, "height": 10},
		{"type":"box", "name":"Plane", "width": 4, "height": 4, "depth": 0.1}
	],
	"entities": [
		{"name":"Floor","shape":"Floor", "bsdf":"mat-Floor"},
		{"name":"Plane","shape":"Plane", "bsdf":"mat-Plane", "transform": [{"rotate": [0,0,45]}, {"translate": [0,0,2]}]}
	],
	"lights": [
		{"type":"env", "name":"Sky", "radiance": "env", "transform": [1,0,0, 0,0,1, 0,1,0]}
	]
}
