{
	"technique": {
		"type": "path",
		"max_depth": 2
	},
	"camera": {
		"type": "perspective",
		"fov": 60,
		"near_clip": 0.01,
		"far_clip": 100,
		"transform": [ 1,0,0,0, 0,0,1,-8, 0,1,0,0 ]
	},
	"film": {
		"size": [1000, 1000]
	},
	"bsdfs": [
		{"type":"diffuse", "name": "base", "reflectance":[0.8, 0.8, 0.8]}
	],
	"shapes": [
		{"type":"cylinder", "name":"Object", "transform": [1,0,0,0, 0,1,0,0, 0,0,-1,0]}
	],
	"entities": [
		{"name":"Object","shape":"Object", "bsdf":"base"}
	],
	"lights": [
		{"type":"env", "name":"Light", "radiance":[1,1,1]}
	]
}
