{
	"technique": {
		"type": "path",
		"max_depth": 8,
		"clamp": 100
	},
	"camera": {
		"type": "perspective",
		"fov": 40,
		"near_clip": 0.1,
		"far_clip": 100,
		"transform": [ 1,0,0,0, 0,0,1,-6, 0,1,0,1.5, 0,0,0,1 ]
	},
	"film": {
		"size": [1000, 1000]
	},
	"textures": [
		{
			"type": "checkerboard",
			"name": "check",
			"scale_x": 10,
			"scale_y": 10,
			"color0": [0.3,0.3,0.3],
			"color1": [1,1,1]
		},
		{
			"type": "image",
			"name": "env",
			"filename": "../../textures/environment/phalzer_forest_01_4k.exr"
		}
	],
	"bsdfs": [
		{"type":"diffuse", "name": "mat-Ground", "reflectance":"check"},
		{"type":"diffuse", "name": "mat-Socket", "reflectance":[0.8,0.8,0.8]}
	],
	"shapes": [
		{"type":"rectangle", "name":"Ground", "width":10, "height":10},
		{"type":"ply", "name":"Sphere", "filename":"../../meshes/IgnisSphere.ply"},
		{"type":"ply", "name":"Socket", "filename":"../../meshes/IgnisSocket.ply", "flip_normals": true}
	],
	"entities": [
		{"name":"Ground","shape":"Ground", "bsdf":"mat-Ground"},
		{"name":"Socket","shape":"Socket", "bsdf":"mat-Socket"},
		{"name":"Sphere","shape":"Sphere", "bsdf":"mat-Sphere"}
	],
	"lights": [
		{"type":"env", "name":"Environment", "radiance":"env", "transform": [0,-1,0, 0,0,1, 1,0,0]}
	]
}
