{
	"technique": {
		"type": "path",
		"max_depth": 64
	},
	"camera": {
		"type": "perspective",
		"fov": 40,
		"near_clip": 0.1,
		"far_clip": 100,
		"transform": [ 1,0,0,0, 0,1,0,0, 0,0,1,-4, 0,0,0,1 ]
	},
	"film": {
		"size": [1000, 1000]
	},
	"bsdfs": [
		{"type":"principled", "name": "mat-Sphere", "base_color": [1,1,1], "ior": 1, "roughness": 0.5, "thin": true, "flatness":1}
	],
	"shapes": [
		{"type":"ply", "name":"Sphere", "filename":"meshes/Sphere.ply"}
	],
	"entities": [
		{"name":"Sphere","shape":"Sphere", "bsdf":"mat-Sphere"}
	],
	"lights": [
		{"type":"constant", "name":"Environment", "radiance":1}
	]
}
