{
	"technique": {
		"type": "path",
		"max_depth": 8,
		"clamp": 100
	},
	"camera": {
		"type": "perspective",
		"fov": 40,
		"near_clip": 0.1,
		"far_clip": 100,
		"transform": [{"lookat": { "origin": [ 0,-6,4 ], "target": [0,0,0] } }]
	},
	"film": {
		"size": [1000, 1000]
	},
	"textures": [
		{
			"type": "image",
			"name": "env",
			"filename": "../../textures/environment/phalzer_forest_01_4k.exr"
		}
	],
	"bsdfs": [
		{"type":"diffuse", "name": "mat-Object", "reflectance":"vec3(prim_coords.x, prim_coords.y, 0)"}
	],
	"entities": [
		{"name":"Object","shape":"Object", "bsdf":"mat-Object"}
	],
	"lights": [
		{"type":"env", "name":"Environment", "radiance":"env", "transform": [0,-1,0, 0,0,1, 1,0,0]}
	]
}
